<?xml version="1.0" encoding="UTF-8"?><!DOCTYPE testcase SYSTEM "testcase.dtd"><testcase><step command="Aktion" comment="true"><![CDATA[Parameter]]><optionalParameter><![CDATA[opt. Parameter]]></optionalParameter></step><step command="Open_Url"><![CDATA[wait_for.html]]></step><step command="Assert_Title"><![CDATA[Wetator / Wait For]]></step><step command="Comment"><![CDATA[click the link]]></step><step command="Click_On"><![CDATA[startIndirectJump]]></step><step command="Assert_Content"><![CDATA[Wait For Result page]]></step></testcase>